
ABCA4,Omega-3 Fatty Acids Supplementation: Therapeutic Potential in a Mouse Model of Stargardt Disease., 2018 Jun 1,"Prokopiou E, Kolovos P, Kalogerou M, Neokleous A, Nicolaou O, Sokratous K,, Kyriacou K, Georgiou T.","Purpose: To evaluate the therapeutic effects of omega-3 (ω3) fatty acids on retinal degeneration in the ABCA4 model of Stargardt disease when the blood level of arachidonic acid (AA)/eicosapentaenoic acid (EPA) ratio is between 1 and 1.5.Methods: Eight-month-old mice were allocated to three groups: wild type (129S1), ABCA4 untreated, and ABCA4 ω3 treated. ω3 treatment lasted 3 months and comprised daily gavage administration of EPA and docosahexaenoic acid (DHA). Blood and retinal fatty acid analysis was performed using gas chromatography to adjust the blood AA/EPA ∼1 to 1.5. Eyecups were histologically examined using transmission electron microscopy and confocal microscopy to evaluate lipofuscin granules and the photoreceptor layer. Retinal N-retinylidene-N-retinylethanolamine (A2E), a major component of retinal pigment epithelium lipofuscin, was quantified using liquid chromatography and tandem mass spectrometry, in addition to retinal proteomic analysis to determine changes in inflammatory proteins.Results: EPA levels increased and AA levels decreased in the blood and retinas of the treatment group. Significantly less A2E and lipofuscin granules were observed in the treatment group. The thickness of the outer nuclear layer was significantly greater in the treatment group (75.66 ± 4.80 μm) than in the wild-type (61.40 ± 1.84 μm) or untreated ABCA4 (56.50 ± 3.24 μm) groups. Proteomic analysis indicated lower levels of complement component 3 (C3) in the treatment group, indicative of lower complement-induced inflammatory response.Conclusions: Three months of ω3 supplementation (AA/EPA ∼1-1.5) reduces A2E levels, lipofuscin granules, and C3 levels in the ABCA4 mouse model of Stargardt disease, consistent with slowing of the disease."
ABCA4,Mutation Spectrum of the ABCA4 Gene in a Greek Cohort with Stargardt Disease: Identification of Novel Mutations and Evidence of Three Prevalent Mutated Alleles., 2018 Apr 30,"Smaragda K, Vassiliki K, George K, Polixeni S, Christoforos G, Anastasios A, Minas AI, Stavrenia K, Theoni P, Ioannis D, Miltiadis TK.","Aim: To evaluate the frequency and pattern of disease-associated mutations of ABCA4 gene among Greek patients with presumed Stargardt disease (STGD1).Materials and Methods: A total of 59 patients were analyzed for ABCA4 mutations using the ABCR400 microarray and PCR-based sequencing of all coding exons and flanking intronic regions. MLPA analysis as well as sequencing of two regions in introns 30 and 36 reported earlier to harbor deep intronic disease-associated variants was used in 4 selected cases.Results: An overall detection rate of at least one mutant allele was achieved in 52 of the 59 patients (88.1%). Direct sequencing improved significantly the complete characterization rate, that is, identification of two mutations compared to the microarray analysis (93.1% versus 50%). In total, 40 distinct potentially disease-causing variants of the ABCA4 gene were detected, including six previously unreported potentially pathogenic variants. Among the disease-causing variants, in this cohort, the most frequent was c.5714+5G&gt;A representing 16.1%, while p.Gly1961Glu and p.Leu541Pro represented 15.2% and 8.5%, respectively.Conclusions: By using a combination of methods, we completely molecularly diagnosed 48 of the 59 patients studied. In addition, we identified six previously unreported, potentially pathogenic ABCA4 mutations."
ABCA4,Extremely hypomorphic and severe deep intronic variants in the ABCA4 locus result in varying Stargardt disease phenotypes., 2018 Aug 1,"Zernant J, Lee W, Nagasaki T, Collison FT, Fishman GA, Bertelsen M, Rosenberg T, Gouras P, Tsang SH,, Allikmets R,.","Autosomal recessive Stargardt disease (STGD1, MIM 248200) is caused by mutations in the ABCA4 gene. Complete sequencing of the ABCA4 locus in STGD1 patients identifies two expected disease-causing alleles in ∼75% of patients and only one mutation in ∼15% of patients. Recently, many possibly pathogenic variants in deep intronic sequences of ABCA4 have been identified in the latter group. We extended our analyses of deep intronic ABCA4 variants and determined that one of these, c.4253+43G&gt;A (rs61754045), is present in 29/1155 (2.6%) of STGD1 patients. The variant is found at statistically significantly higher frequency in patients with only one pathogenic ABCA4 allele, 23/160 (14.38%), MAF = 0.072, compared to MAF = 0.013 in all STGD1 cases and MAF = 0.006 in the matching general population (P &lt; 1 × 10-7). The variant, which is not predicted to have any effect on splicing, is the first reported intronic ""extremely hypomorphic allele"" in the ABCA4 locus; that is, it is pathogenic only when in trans with a loss-of-function ABCA4 allele. It results in a distinct clinical phenotype characterized by late onset of symptoms and foveal sparing. In ∼70% of cases the variant was allelic with the c.6006-609T&gt;A (rs575968112) variant, which was deemed nonpathogenic. Another rare deep intronic variant, c.5196+1056A&gt;G (rs886044749), found in 5/834 (0.6%) of STGD1 cases is, conversely, a severe allele. This study determines pathogenicity for three noncoding variants in STGD1 patients of European descent accounting for ∼3% of the disease. Defining disease-associated alleles in the noncoding sequences of the ABCA4 locus can be accomplished by integrated clinical and genetic analyses."
ABCA4,Mutations in GPR143/OA1 and ABCA4 Inform Interpretations of Short-Wavelength and Near-Infrared Fundus Autofluorescence., 2018 May 1,"Paavo M, Zhao J, Kim HJ, Lee W, Zernant J, Cai C, Allikmets R,, Tsang SH,, Sparrow JR,.","Purpose: We sought to advance interpretations and quantification of short-wavelength fundus autofluorescence (SW-AF) emitted from bisretinoid lipofuscin and near-infrared autofluoresence (NIR-AF) originating from melanin.Methods: Carriers of mutations in X-linked GPR143/OA1, a common form of ocular albinism; patients with confirmed mutations in ABCA4 conferring increased SW-AF; and subjects with healthy eyes were studied. SW-AF (488 nm excitation, 500-680 nm emission) and NIR-AF (excitation 787 nm, emission &gt;830 nm) images were acquired with a confocal scanning laser ophthalmoscope. SW-AF images were analyzed for quantitative autofluoresence (qAF). Analogous methods of image acquisition and analysis were performed in albino and pigmented Abca4 mice and wild-type mice.Results: Quantitation of SW-AF (qAF), construction of qAF color-coded maps, and examination of NIR-AF images from GPR143/OA1 carriers revealed mosaics in which patches of fundus exhibiting NIR-AF signal had qAF levels within normal limits whereas the hypopigmented areas in the NIR-AF image corresponded to foci of elevated qAF. qAF also was increased in albino versus pigmented mice. Although melanin contributes to fundus infrared reflectance, the latter appeared to be uniform in en face reflectance images of GPR143/OA1-carriers. In patients diagnosed with ABCA4-associated disease, NIR-AF increased in tandem with increased qAF originating in bisretinoid lipofuscin. Similarly in Abca4 mice having increased SW-AF, NIR-AF was more pronounced than in wild-type mice.Conclusions: These studies corroborate RPE melanin as the major source of NIR-AF but also indicate that bisretinoid lipofuscin, when present at sufficient concentrations, contributes to the NIR-AF signal. Ocular melanin attenuates the SW-AF signal."
ABCA4,Correlating the Expression and Functional Activity of ABCA4 Disease Variants With the Phenotype of Patients With Stargardt Disease., 2018 May 1,"Garces F, Jiang K, Molday LL, Stöhr H, Weber BH, Lyons CJ, Maberley D, Molday RS,.","Purpose: Stargardt disease (STGD1), the most common early-onset recessive macular degeneration, is caused by mutations in the gene encoding the ATP-binding cassette transporter ABCA4. Although extensive genetic studies have identified more than 1000 mutations that cause STGD1 and related ABCA4-associated diseases, few studies have investigated the extent to which mutations affect the biochemical properties of ABCA4. The purpose of this study was to correlate the expression and functional activities of missense mutations in ABCA4 identified in a cohort of Canadian patients with their clinical phenotype.Methods: Eleven patients from British Columbia were diagnosed with STGD1. The exons and exon-intron boundaries were sequenced to identify potential pathologic mutations in ABCA4. Missense mutations were expressed in HEK293T cells and their level of expression, retinoid substrate binding properties, and ATPase activities were measured and correlated with the phenotype of the STGD1 patients.Results: Of the 11 STGD1 patients analyzed, 7 patients had two mutations in ABCA4, 3 patients had one detected mutation, and 1 patient had no mutations in the exons and flanking regions. Included in this cohort of patients was a severely affected 11-year-old child who was homozygous for the novel p.Ala1794Pro mutation. Expression and functional analysis of this variant and other disease-associated variants compared favorably with the phenotypes of this cohort of STGD1 patients.Conclusions: Although many factors contribute to the phenotype of STGD1 patients, the expression and residual activity of ABCA4 mutants play a major role in determining the disease severity of STGD1 patients."
ABCA4,A novel small molecule chaperone of rod opsin and its potential therapy for retinal degeneration., 2018 May 17,"Chen Y,,, Chen Y,, Jastrzebska B,, Golczak M,, Gulati S,, Tang H, Seibel W, Li X, Jin H, Han Y, Gao S, Zhang J, Liu X, Heidari-Torkabadi H, Stewart PL,, Harte WE, Tochtrop GP, Palczewski K,.","Rhodopsin homeostasis is tightly coupled to rod photoreceptor cell survival and vision. Mutations resulting in the misfolding of rhodopsin can lead to autosomal dominant retinitis pigmentosa (adRP), a progressive retinal degeneration that currently is untreatable. Using a cell-based high-throughput screen (HTS) to identify small molecules that can stabilize the P23H-opsin mutant, which causes most cases of adRP, we identified a novel pharmacological chaperone of rod photoreceptor opsin, YC-001. As a non-retinoid molecule, YC-001 demonstrates micromolar potency and efficacy greater than 9-cis-retinal with lower cytotoxicity. YC-001 binds to bovine rod opsin with an EC<sub>50</sub> similar to 9-cis-retinal. The chaperone activity of YC-001 is evidenced by its ability to rescue the transport of multiple rod opsin mutants in mammalian cells. YC-001 is also an inverse agonist that non-competitively antagonizes rod opsin signaling. Significantly, a single dose of YC-001 protects Abca4  Rdh8  mice from bright light-induced retinal degeneration, suggesting its broad therapeutic potential."
ABCA4,Novel variants identified with next-generation sequencing in Polish patients with cone-rod dystrophy., 2018 Apr 26,"Wawrocka A, Skorczyk-Werner A, Wicher K, Niedziela Z,, Ploski R, Rydzanicz M, Sykulski M, Kociecki J, Weisschuh N, Kohl S, Biskup S, Wissinger B, Krawczynski MR,.","Purpose: The aim of this study was to identify the molecular genetic basis of cone-rod dystrophy in 18 unrelated families of Polish origin. Cone-rod dystrophy is one of the inherited retinal dystrophies, which constitute a highly heterogeneous group of disorders characterized by progressive dysfunction of photoreceptors and retinal pigment epithelium (RPE) cells.Methods: The study group was composed of four groups of patients representing different Mendelian inheritance of the disease: autosomal dominant (AD), autosomal recessive (AR), X-linked recessive (XL), and autosomal recessive or X-linked recessive (AR/XL). The combined molecular strategy included Sanger sequencing of the RPGR-ORF15 gene (three families with XL and three families with the AR/XL mode of inheritance), mutation-specific microarray analysis of the ABCA4 gene (five families with the AR mode of inheritance and two families with the AR/XL mode of inheritance), targeted next-generation sequencing (NGS) of inherited retinal disease-associated (IRD) genes (seven families with the AD mode of inheritance and five families with the AR mode of inheritance), and whole exome sequencing, performed in select families who had been mutation-negative in the analysis with the targeted NGS panel (one family with the AD mode of inheritance, one family with the AR mode of inheritance, and two families with the AR/XL mode of inheritance).Results: Based on this combined strategy, we managed to identify potentially causative variants in seven out of 18 families with CRD. Five of these variants are novel: c.3142_3143dupAA, p.(Glu1049Argfs*41) in the RPGR-ORF15 gene, two variants: c.1612delT, p.(Trp538Glyfs*15) and c.2389dupG, p.(Ile798Hisfs*20) in the PROM1 gene in one family, c.592A&gt;C, p.(Ser198Arg) in the PRPH2 gene and the variant c.1691A&gt;G, p.(Asp564Gly) in the ATF6 gene that we have already reported to be pathogenic. NGS on the IRD panel allowed the molecular basis of CRD to be identified in four out of 14 families with a total detection rate of 38%. WES allowed identification of the molecular genetic basis of CRD in one family.Conclusions: This is the first report on the spectrum of disease genes and pathogenic variants causing CRD in the Polish population. The study presents five novel variants identified in four genes and therefore, broadens the spectrum of probable pathogenic variants associated with CRD."
ABCA4,Retinal findings in a patient with mutations in ABCC6 and ABCA4., 2018 May 16,"Mahroo OA,,, Fujinami K,,, Moore AT,,, Webster AR,.",Can't find  abstract!
